{
  "id": "evt_order.presort_suppressed_ord_fixture_presort_suppressed_1",
  "type": "order.presort_suppressed",
  "version": "2026-08-19",
  "created_at": "2026-08-19T17:00:00+00:00",
  "data": {
    "orderId": "ord_fixture_presort_suppressed",
    "suppressedCount": 3,
    "recipients": [
      {
        "contactId": "contact_fixture_001",
        "addressType": "PROPERTY"
      },
      {
        "contactId": "contact_fixture_001",
        "addressType": "PROPERTY"
      },
      {
        "contactId": "contact_fixture_002",
        "addressType": "MAILING"
      }
    ]
  }
}
